{
  "schema_version": 1,
  "manifest": {
    "schema_version": 1,
    "workload_id": "fibonacci",
    "backend": "plonky3",
    "profile": "tinyzkp-p3-goldilocks-v1",
    "input_generator": {
      "kind": "fibonacci",
      "initial_a": 0,
      "initial_b": 1
    },
    "logical_rows": 16,
    "deterministic_seed": 0,
    "resource_policy": {
      "mode": "scratch",
      "max_resident_bytes": 134217728,
      "max_scratch_bytes": 1073741824,
      "scratch_dir": "/tmp/tinyzkp-kat-fibonacci-16",
      "max_threads": 1,
      "checkpoint_policy": "delete_on_success"
    },
    "expected_verifier": "p3_uni_stark_0.6.1"
  },
  "manifest_digest_hex": "9d131602e27428ca290c5ca87d543d085873840e4dba22dd3d8074945e57efcd",
  "proof_base64url": "Ab3PsZ6X7NmsVp7Mr-Oc9JWJhAHLm-f14NnAuF2X9Mud0tCm5ycB57-S6qC56txIstuXkcSh99lHuq2irJLX6b5R35HvkfrzteGoAQACqtKXzNGU0-zHAfe21KWrlPi9lgGc1eiPpc7YhU6Svri4oqW68YkBAQKnqJaDgd3oiZYBtPLzwarM2-KzAbb3kPP2jcORb_7sxsS-t46SxgEAAAECr8b9k-ayuvf8AfOE49ak7JXKX9bOp6iK_aeeevm0zJ_I3sb_kwEABAHo5I_9mbb68weC7vH0p9-8mawBorzGhuTX3NjwAZn6y-7Evp2q3gEBhozq66ve5amjAaaR3dXxzbTGB8i69sOKz4aJUueDh6Hvgqe-0QEB25rztKPa5MJngri08ODt7s4Z7Jyo9vGB7KhuqMO_zeCg78cfAcbypuffiOyGYLDkqqbW6IXOxAHpzJ3wtPn0iQKF1cG2jtCQvHMEAAAAAGQCAQLOzfOOuLCUlvIBo6P47fLZovR7BYnTzu_NkpH0sAG2j5CV_cbEn7wBlPTbudCik8HbAfWyp-PO1YiHO42vitXruJv8YvjEipi-juL-8AHZ2prYvdHNxUfPkfv_xpD5iCmwx6Ta--TN2zCn4dbyq7zNz7QB2sH4iMjXjcxlo7ODnvLDjqiqAdWs0bbX64zpI5WM8NHm3efWZYDcpvqU_o3fwQG6osLE553VptsBsNeHsL-CxsiwAaS8jpqdnt3OH5qbrLiF79_3e4771f3_8v6bGwEC5JDi4c60_Jh_ur-m_NCO2lgF8ZXa8Jftl5dXz7yYwvKc_NS2AenQjaaOu8vxU6yNxN_muoSSbZu44K7mzYuIswGwnZP2tYj867YBieHsgK_I8ZGoAfHD8M6KtKDXReeo_oGJg42IO7rD57TKiZfw9QGLpIXqtvGMpeAB6uan99LPoNCcAZ6x6Zy6qurDngGX7Y3ygNSck0T7rb_Wm9-0m0yZq_WHy5rcwDGf7fG-paeo8ccBtbjikMfP7PnbAcz-7eHokt2yiAGGraqY9M3Y_3AEAQHJoM3Mmrjq7_cBk_jZiqypnJ1PBLSdxM3j4uCohwGF2uqX_4i04S-Q1LmSno2TzMQB_J7Ox53b-plvm-jot5PMmu__AZCZ95ecpYTb5gGftK7P4_2Kp2eW_Mjarc2wl6YB_tO-gI-p_dq6AYi9hf3alfeVXui30sT4ieGw1wGhj66C9Z776-oBtvCi9NyBsvG5Aeqooq_hy8DojwHn4rme1pveiPAB-bfRxvGPp6eVAQEBmb2KlqCt3OrVAd26kYTfkNyzZQP-jvzim4-3VeTnntOumYClXJGrssT7wcfbL7nAiZ6u79rzjgGkoL78347459EB86Tr6cjYkdRE9-SLu_rt--xEnbyvsfKSmZI58a3i0cbiyKw5qZCdooiK3LYn7aqgibCs0IIzx4PbxIm5lk4BAfPH04O7k9KktAHY4IH6tv7J0p8BApSd_biC2ISUEuv54Yuh4oPGrAGP0cPRlb6K63Lmmtno5ovdu7cB9eCNg_6wt7-3AeHP__uu5K71pgG-0NXDo9XxtkDH-u-Hruqlv9QBAQGJrYOq_8irneUBq-bWzrSkkv1kAb3grb-Kr_2vRrC8yIP7nbq7L7P8h4WbytniwgHb39rj0qr18FgCAQKQ7dHfjIHh_44B8KSCydO9nJFVBbXooYuu5OWZ7AGDxZye4YW-s2e6vomG-OS32PQBjMnkstX71aIb46-Y95rrt4D_AdbXuam8spLejgG-leCFpbrutQvb-s29vOr55OEBrdSGvea8opDZAaKX2_3n2ZnDO6_V1tnVjMuRM4_IioKjiqyYT_zn2IOi-JKGyQGJ7vCgmImtmdwBjYjc-_3Ay4xd3tOmnMOG_f2HAZHM-fqc_7bphAG6qJSPxZLbxAydtYC3tpW0pbYBpcSt2NeAlumGAQECuq7n5vvd4KM1qcDJpszsyrhZBZX_wYrLuJ6uuwGly5mQvafNuf8B7p2s1Oml9qN1-rrJkOia4_ZWksKVttTL2sZ9n-eQlYXWpNYUtun-5f7ck6VQnMXI1bK7wKG4AeqziMeVi7WxxwGP1I60mpHr2FO71Yq62qry5NIBv8fF57iy6YQ_9OrGt4un2tD9AYuioqu60I_uOcCAqtjzx9iV2QGUxfeI9q-KwXbjh-G1_9alzHzZmri26PD0uF_G79_uzLWZ9WuG1ezHqP-ZiVkEAQG4l8CqxsLapLwB47P94c-jg72HAQSF_Zbbi8igy60Bsr7r2N2FyvA_-fPStuyVwYHyAeCVgNTBx-PbwgGJuZevsYnQ_-0BlJe98OyYyKVr4Pak2-LE_p77Acue-uH0-qbNPZTPmpzRmP3LuwHVmZT1xc7LskOb8Z7CzKvzpFWepKHCjY7mhtABjrHok5fB9qxxzNqWn8WE-9OFAdeomevU1uC-wQG3p-D9gZz3xy0BAdrLu_fbsc3QKcGtkIvyt6yqIwPlg6TY06_u148BvKH_tq36y-G6Aa_Dp5Cy5cWkhwHRgPSX-KrBjliY5rfU_c2D-94BounxiYvH_Oswq_-Dzcyxlq2yAeb1jPzZq52svgHK6uimrOTzxVH26LeOw8yh3wqapJDYv8rBr0Wuov_P6I7gvKUBAQG7rsaFzLLFuVKS05GN4YChhDwChb3Kg_qe2-jAAbb15rKW4IblmgGR__-2wKCLotoBhqDDuqH128uHAc664_6Rk_nIDMTh962psoW1fIfZ8bTW2ryK6gGM5cGo7MDz11oBAeb5tazg-NnP-wGowNrN2Ijgr0cBgerElaTRgeiSAbv77PGFzLO5PIKEvLqfp6HxmwH2z5PH9NH91GECAQKD1oDjv_Wv2IgB05LVlpWV_-SZAQX-1tX7pdjN8L4Bj8SZh4qay4znAYumir_D_oLmXL2b0pqNwZTH6AH865W1lZnpiQ6k9c76trix1dAB5_P8iqa1kvNl3-7ogeC_kuLAAa3Uhr3mvKKQ2QGil9v959mZwzuv1dbZ1YzLkTOPyIqCo4qsmE_859iDoviShskBie7woJiJrZncAY2I3Pv9wMuMXd7TppzDhv39hwGRzPn6nP-26YQBuqiUj8WS28QMnbWAt7aVtKW2AaXErdjXgJbphgEBAvyfg9uWrMeEygGOx-7DjZ3Fi9sBBfWa5KDw4pTcWuHJlee9jojBYrmukIy529W9ngGu1J-i973v2Reh7sbTl7nVsn2218PjoPP397oBiq754oin66lG3MScgpeIrL7CAeqziMeVi7WxxwGP1I60mpHr2FO71Yq62qry5NIBv8fF57iy6YQ_9OrGt4un2tD9AYuioqu60I_uOcCAqtjzx9iV2QGUxfeI9q-KwXbjh-G1_9alzHzZmri26PD0uF_G79_uzLWZ9WuG1ezHqP-ZiVkEAQGRpdP92Mi_mhqanZPGj-SEudYBBJLpw4zVjKCETd_GhNzN6cj-IPTT4ICsvvuxG62xk8DN9tD81QGJuZevsYnQ_-0BlJe98OyYyKVr4Pak2-LE_p77Acue-uH0-qbNPZTPmpzRmP3LuwHVmZT1xc7LskOb8Z7CzKvzpFWepKHCjY7mhtABjrHok5fB9qxxzNqWn8WE-9OFAdeomevU1uC-wQG3p-D9gZz3xy0BAaPZ1-jfuoDoOpCzmJ3OiISwIQPlg6TY06_u148BvKH_tq36y-G6Aa_Dp5Cy5cWkhwHRgPSX-KrBjliY5rfU_c2D-94BounxiYvH_Oswq_-Dzcyxlq2yAeb1jPzZq52svgHK6uimrOTzxVH26LeOw8yh3wqapJDYv8rBr0Wuov_P6I7gvKUBAQG7rsaFzLLFuVKS05GN4YChhDwChb3Kg_qe2-jAAbb15rKW4IblmgGR__-2wKCLotoBhqDDuqH128uHAc664_6Rk_nIDMTh962psoW1fIfZ8bTW2ryK6gGM5cGo7MDz11oBAeb5tazg-NnP-wGowNrN2Ijgr0cBgerElaTRgeiSAbv77PGFzLO5PIKEvLqfp6HxmwH2z5PH9NH91GECAQKykr3OuvrzkIoB-JbIpp3lme-aAQWm2Pb7tcuD2J0Byd2Fts-yopEI4fag-M3O3ferAbvkorSRyN9WqIzY4u6tiOKfAdmbrP_kpLCwpwHf9qa2-_Tci1uTgPLS-cmrlzqY_tmt4Oaon80BkabHzsetkLshqLm__PWx5rOJAa_GtoHShcmwlAHPgb-z78ChsP8BufDIgdTusu0Xooa-mcGetZ9uutq_mqyRza62AbDXh7C_gsbIsAGkvI6anZ7dzh-am6y4he_f93uO-9X9__L-mxsBAv3nrI_Vwbe4Y6_lyN3w6pPw9wEFoPHCzpXu3INdq_eJ-MXRj73sAfu-s572yb7c9gGCtr-gnvCU6dcB6rr_4JGX1cCtAfG9h6OX8__nvwGBgI27w5T9oIIB2ujk6M-Qg8miAcmdvKeh29vtZ7bHh6awn7HqgwGT-42j9PDtu6kBv56B5O2v_aMXvIrQyPvemPOaAbKlvomN6KmwmAHUlrW836Lur-YBoYK366HuhslYn-3xvqWnqPHHAbW44pDHz-z52wHM_u3h6JLdsogBhq2qmPTN2P9wBAEBrvv20IfwluRWlaGq5rq78N0gBOXp6r2vkIWZpQHwtJ7zyuHYpF6CqKH179TJ6IQBn4Lr-suKsZ0kj8Dgprj9iPOMAZfeg7y7gZiatQHXpPTVnP6drSfWqNih8K7pihOTkon-tZqN2nOplc2-5IWwkrMBn-PIzKCOqsaoAYbjh7bDgrvHmwG28KL03IGy8bkB6qiir-HLwOiPAefiuZ7Wm96I8AH5t9HG8Y-np5UBAQGZm-nO8uSlwmqqp6LwifCe1ckBA8i99ObEs7Ka2wHFnZ7Hsq6difYBsaG2mvrewYtwwcTvzbz998Js0KnMyZbi_NmcAbPFg-ng266sgwGZuNeksu33xAicoeesk4Xaon7xreLRxuLIrDmpkJ2iiIrctiftqqCJsKzQgjPHg9vEibmWTgEB6IuR6O-NmoLEAfa698jC2o_BmAEC8q32meL_4rGIAYX15vb_7bHcBdyAv_LCmp2lhgHl4pLJju-Driz14I2D_rC3v7cB4c__-67krvWmAb7Q1cOj1fG2QMf674eu6qW_1AEBAbSsveC0gp69W-L70ZTlhLC_awG94K2_iq_9r0awvMiD-526uy-z_IeFm8rZ4sIB29_a49Kq9fBYAgEC6Yauuf362K7CAcGciJ7084_TtQEF_a2ZyMS29ZzRAZmy1c3s3beQIvOa4LLO8eT_fs2GmJGHpIaLF-6z6PjCkZH5Qp3569Hx5avJmwHUoujxgtGKz9AB6JKb7YHvlaYSmP7ZreDmqJ_NAZGmx87HrZC7Iai5v_z1seaziQGvxraB0oXJsJQBz4G_s-_AobD_AbnwyIHU7rLtF6KGvpnBnrWfbrrav5qskc2utgGw14ewv4LGyLABpLyOmp2e3c4fmpusuIXv3_d7jvvV_f_y_psbAQKLr8ryuvWxj8UBr8Ga9rjdgdG_AQWBlOTh5f3Inxia5NuN3caRgrAB37Dj8JH3uOaGAduJk-We8sSmb9XukufuxsTiCcLGruLMx-jQS8-29NCh9pjAmgH3soHK6--woyLJnbynodvb7We2x4emsJ-x6oMBk_uNo_Tw7bupAb-egeTtr_2jF7yK0Mj73pjzmgGypb6JjeipsJgB1Ja1vN-i7q_mAaGCt-uh7obJWJ_t8b6lp6jxxwG1uOKQx8_s-dsBzP7t4eiS3bKIAYatqpj0zdj_cAQBAfnXl8-w96unceSqyYiGrMauKAT6mrmv7p_d_F3C7ZWcpoay2ecBpbSd667-5ZPeAcv0zpq2vf6ntQGPwOCmuP2I84wBl96DvLuBmJq1Adek9NWc_p2tJ9ao2KHwrumKE5OSif61mo3ac6mVzb7khbCSswGf48jMoI6qxqgBhuOHtsOCu8ebAbbwovTcgbLxuQHqqKKv4cvA6I8B5-K5ntab3ojwAfm30cbxj6enlQEBAZm8x5GkjdPDywGmlpHE-4uG24sBA8i99ObEs7Ka2wHFnZ7Hsq6difYBsaG2mvrewYtwwcTvzbz998Js0KnMyZbi_NmcAbPFg-ng266sgwGZuNeksu33xAicoeesk4Xaon7xreLRxuLIrDmpkJ2iiIrctiftqqCJsKzQgjPHg9vEibmWTgEB6IuR6O-NmoLEAfa698jC2o_BmAEC8q32meL_4rGIAYX15vb_7bHcBdyAv_LCmp2lhgHl4pLJju-Driz14I2D_rC3v7cB4c__-67krvWmAb7Q1cOj1fG2QMf674eu6qW_1AEBAbSsveC0gp69W-L70ZTlhLC_awG94K2_iq_9r0awvMiD-526uy-z_IeFm8rZ4sIB29_a49Kq9fBYAgECvtHx_66Q1e07mqCKy4i72evTAQW_-b702saU8r8Bx4SG06TQ0d2oAYPSmZGoiZb9RIqTmJCfpq7UeO6z6PjCkZH5Qp3569Hx5avJmwHUoujxgtGKz9AB6JKb7YHvlaYSmP7ZreDmqJ_NAZGmx87HrZC7Iai5v_z1seaziQGvxraB0oXJsJQBz4G_s-_AobD_AbnwyIHU7rLtF6KGvpnBnrWfbrrav5qskc2utgGw14ewv4LGyLABpLyOmp2e3c4fmpusuIXv3_d7jvvV_f_y_psbAQLaiPb6itHM6WG0hp3UrMLTrGcF3_yM1aHk8phh2u3Ltf2JjtijAYC37vfth5m-twGCw53hxdv7_U_V7pLn7sbE4gnCxq7izMfo0EvPtvTQofaYwJoB97KByuvvsKMiyZ28p6Hb2-1ntseHprCfseqDAZP7jaP08O27qQG_noHk7a_9oxe8itDI-96Y85oBsqW-iY3oqbCYAdSWtbzfou6v5gGhgrfroe6GyVif7fG-paeo8ccBtbjikMfP7PnbAcz-7eHokt2yiAGGraqY9M3Y_3AEAQGQ_s6w0InO0LcBirLFjOKCiLXNAQT6mrmv7p_d_F3C7ZWcpoay2ecBpbSd667-5ZPeAcv0zpq2vf6ntQGPwOCmuP2I84wBl96DvLuBmJq1Adek9NWc_p2tJ9ao2KHwrumKE5OSif61mo3ac6mVzb7khbCSswGf48jMoI6qxqgBhuOHtsOCu8ebAbbwovTcgbLxuQHqqKKv4cvA6I8B5-K5ntab3ojwAfm30cbxj6enlQEBAZm8x5GkjdPDywGmlpHE-4uG24sBA8i99ObEs7Ka2wHFnZ7Hsq6difYBsaG2mvrewYtwwcTvzbz998Js0KnMyZbi_NmcAbPFg-ng266sgwGZuNeksu33xAicoeesk4Xaon7xreLRxuLIrDmpkJ2iiIrctiftqqCJsKzQgjPHg9vEibmWTgEB6IuR6O-NmoLEAfa698jC2o_BmAEC8q32meL_4rGIAYX15vb_7bHcBdyAv_LCmp2lhgHl4pLJju-Driz14I2D_rC3v7cB4c__-67krvWmAb7Q1cOj1fG2QMf674eu6qW_1AEBAbSsveC0gp69W-L70ZTlhLC_awG94K2_iq_9r0awvMiD-526uy-z_IeFm8rZ4sIB29_a49Kq9fBYAgECkK2KycrHyIrBAceA9cuwtuvVQAWPt-HL2IvI4k3t7Y6y7ZWumgndyMn586Guh7oBuNq8sPfsup7rAemD5MK1jaH9iAG_5cnI4Ki8yfMBrIK557q6i-pzqaq-w4iH8J-gAbDHpNr75M3bMKfh1vKrvM3PtAHawfiIyNeNzGWjs4Oe8sOOqKoB1azRttfrjOkjlYzw0ebd59ZlgNym-pT-jd_BAbqiwsTnndWm2wGw14ewv4LGyLABpLyOmp2e3c4fmpusuIXv3_d7jvvV_f_y_psbAQLjksKk5vTw--sB7Yizm5aOm4dQBYjFptuN6f2-SOzdqrzMvKmWM6Cug5DFu4_s8gG4tuG8odHuuROXvv3og8jq4-QBloix85CNs6-pAfrEuaiJn7iruwGxreHqlr6F_akB56j-gYmDjYg7usPntMqJl_D1AYukheq28Yyl4AHq5qf30s-g0JwBnrHpnLqq6sOeAZftjfKA1JyTRPutv9ab37SbTJmr9YfLmtzAMZ_t8b6lp6jxxwG1uOKQx8_s-dsBzP7t4eiS3bKIAYatqpj0zdj_cAQBAeKAyqDbucuQJrDXsfCL19vpfQS3kpfa28LuhMcBvYLq2ZXOrNy4AfmZsbj6x5zRPdnQ1s2Bs7yWYpvo6LeTzJrv_wGQmfeXnKWE2-YBn7Suz-P9iqdnlvzI2q3NsJemAf7TvoCPqf3augGIvYX92pX3lV7ot9LE-InhsNcBoY-ugvWe--vqAbbwovTcgbLxuQHqqKKv4cvA6I8B5-K5ntab3ojwAfm30cbxj6enlQEBAcX-yITi7tOAugH15qKLu8Xen38D_o784puPt1Xk557TrpmApVyRq7LE-8HH2y-5wImeru_a844BpKC-_N-O-OfRAfOk6-nI2JHURPfki7v67fvsRJ28r7HykpmSOfGt4tHG4sisOamQnaKIity2J-2qoImwrNCCM8eD28SJuZZOAQHzx9ODu5PSpLQB2OCB-rb-ydKfAQKUnf24gtiElBLr-eGLoeKDxqwBj9HD0ZW-iuty5prZ6OaL3bu3AfXgjYP-sLe_twHhz__7ruSu9aYBvtDVw6PV8bZAx_rvh67qpb_UAQEBia2Dqv_Iq53lAavm1s60pJL9ZAG94K2_iq_9r0awvMiD-526uy-z_IeFm8rZ4sIB29_a49Kq9fBYAgECy7fK_Kma2vlW5v653_zFtPAIBcjqstfYhN31LuqDnuSo8u-scpSe-em494i96AGcq__Y9NuT1w-E8qLvloOunQqBjbTegLLc1CS3-ZLkkOrFpwOivrHp8Y270IgB1urentOPj905rIzsrb20prWPAePUxbnb-pfoRLCmtbSJhOSSYNWs0bbX64zpI5WM8NHm3efWZYDcpvqU_o3fwQG6osLE553VptsBsNeHsL-CxsiwAaS8jpqdnt3OH5qbrLiF79_3e4771f3_8v6bGwECjpO20q6-_5-VAcDHrZD4pZO1ZAXFvrPC04G-1L0BtaOr3bHIra4Q8tzLqe_XmvDqAbOc-Yv9ubWpK8P6hI6Ahr69CILAq4qM4oqkEae37rzXpLaka-ClnuPc5NjsggHOlZm19szF